### ISSUE TITLE
TCP Retransmission

### ISSUE THREAD

**Issue by wade-liwei** [libp2p/go-libp2p#2065]
two nodes made a connection directly,
one broadcast continued msg to the other,  after about 5 minutes, get the following error.
please help me.

 1 0.000000000 172.31.47.80 → 172.31.22.129 TCP 74 5002 → 5002 [SYN] Seq=0 Win=62727 Len=0 MSS=8961 SACK_PERM=1 TSval=382203985 TSecr=0 WS=128
    2 1.021884835 172.31.47.80 → 172.31.22.129 TCP 74 [TCP Retransmission] [TCP Port numbers reused] 5002 → 5002 [SYN] Seq=0 Win=62727 Len=0 MSS=8961 SACK_PERM=1 TSval=382205007 TSecr=0 WS=128
    3 3.037877359 172.31.47.80 → 172.31.22.129 TCP 74 [TCP Retransmission] [TCP Port numbers reused] 5002 → 5002 [SYN] Seq=0 Win=62727 Len=0 MSS=8961 SACK_PERM=1 TSval=382207023 TSecr=0 WS=128
    4 60.075058778 125.212.217.214 → 172.31.47.80 TCP 60 26200 → 5002 [SYN] Seq=0 Win=46295 Len=0 MSS=1460
    5 60.075078336 172.31.47.80 → 125.212.217.214 TCP 58 5002 → 26200 [SYN, ACK] Seq=0 Ack=1 Win=62727 Len=0 MSS=8961
    6 61.085884907 172.31.47.80 → 125.212.217.214 TCP 58 [TCP Retransmission] 5002 → 26200 [SYN, ACK] Seq=0 Ack=1 Win=62727 Len=0 MSS=8961
    7 63.101880557 172.31.47.80 → 125.212.217.214 TCP 58 [TCP Retransmission] 5002 → 26200 [SYN, ACK] Seq=0 Ack=1 Win=62727 Len=0 MSS=8961
    8 67.261874776 172.31.47.80 → 125.212.217.214 TCP 58 [TCP Retransmission] 5002 → 26200 [SYN, ACK] Seq=0 Ack=1 Win=62727 Len=0 MSS=8961
    9 74.999726709 172.31.47.80 → 172.31.22.129 TCP 74 [TCP Port numbers reused] 5002 → 5002 [SYN] Seq=0 Win=62727 Len=0 MSS=8961 SACK_PERM=1 TSval=382278985 TSecr=0 WS=128
   10 75.453884746 172.31.47.80 → 125.212.217.214 TCP 58 [TCP Retransmission] 5002 → 26200 [SYN, ACK] Seq=0 Ack=1 Win=62727 Len=0 MSS=8961
   11 76.029884461 172.31.47.80 → 172.31.22.129 TCP 74 [TCP Retransmission] [TCP Port numbers reused] 5002 → 5002 [SYN] Seq=0 Win=62727 Len=0 MSS=8961 SACK_PERM=1 TSval=382280015 TSecr=0 WS=128
   12 78.045880018 172.31.47.80 → 172.31.22.129 TCP 74 [TCP Retransmission] [TCP Port numbers reused] 5002 → 5002 [SYN] Seq=0 Win=62727 Len=0 MSS=8961 SACK_PERM=1 TSval=382282031 TSecr=0 WS=128
   13 91.581881959 172.31.47.80 → 125.212.217.214 TCP 58 [TCP Retransmission] 5002 → 26200 [SYN, ACK] Seq=0 Ack=1 Win=62727 Len=0 MSS=8961
   14 169.999765428 172.31.47.80 → 172.31.22.129 TCP 74 [TCP Port numbers reused] 5002 → 5002 [SYN] Seq=0 Win=62727 Len=0 MSS=8961 SACK_PERM=1 TSval=382373985 TSecr=0 WS=128
   15 171.005878045 172.31.47.80 → 172.31.22.129 TCP 74 [TCP Retransmission] [TCP Port numbers reused] 5002 → 5002 [SYN] Seq=0 Win=62727 Len=0 MSS=8961 SACK_PERM=1 TSval=382374991 TSecr=0 WS=128
   16 173.021877671 172.31.47.80 → 172.31.22.129 TCP 74 [TCP Retransmission] [TCP Port numbers reused] 5002 → 5002 [SYN] Seq=0 Win=62727 Len=0 MSS=8961 SACK_PERM=1 TSval=382377007 TSecr=0 WS=128
   17 284.999660175 172.31.47.80 → 172.31.22.129 TCP 74 [TCP Port numbers reused] 5002 → 5002 [SYN] Seq=0 Win=62727 Len=0 MSS=8961 SACK_PERM=1 TSval=382488985 TSecr=0 WS=128
   18 286.013876535 172.31.47.80 → 172.31.22.129 TCP 74 [TCP Retransmission] [TCP Port numbers reused] 5002 → 5002 [SYN] Seq=0 Win=62727 Len=0 MSS=8961 SACK_PERM=1 TSval=382489999 TSecr=0 WS=128
   19 288.029873874 172.31.47.80 → 172.31.22.129 TCP 74 [TCP Retransmission] [TCP Port numbers reused] 5002 → 5002 [SYN] Seq=0 Win=62727 Len=0 MSS=8961 SACK_PERM=1 TSval=382492015 TSecr=0 WS=128
   20 419.999997330 172.31.47.80 → 172.31.22.129 TCP 74 [TCP Port numbers reused] 5002 → 5002 [SYN] Seq=0 Win=62727 Len=0 MSS=8961 SACK_PERM=1 TSval=382623985 TSecr=0 WS=128
   21 421.021880560 172.31.47.80 → 172.31.22.129 TCP 74 [TCP Retransmission] [TCP Port numbers reused] 5002 → 5002 [SYN] Seq=0 Win=62727 Len=0 MSS=8961 SACK_PERM=1 TSval=382625007 TSecr=0 WS=128
   22 423.037873567 172.31.47.80 → 172.31.22.129 TCP 74 [TCP Retransmission] [TCP Port numbers reused] 5002 → 5002 [SYN] Seq=0 Win=62727 Len=0 MSS=8961 SACK_PERM=1 TSval=382627023 TSecr=0 WS=128
   23 574.999691647 172.31.47.80 → 172.31.22.129 TCP 74 [TCP Port numbers reused] 5002 → 5002 [SYN] Seq=0 Win=62727 Len=0 MSS=8961 SACK_PERM=1 TSval=382778985 TSecr=0 WS=128
   24 576.029879695 172.31.47.80 → 172.31.22.129 TCP 74 [TCP Retransmission] [TCP Port numbers reused] 5002 → 5002 [SYN] Seq=0 Win=62727 Len=0 MSS=8961 SACK_PERM=1 TSval=382780015 TSecr=0 WS=128
   25 578.045883836 172.31.47.80 → 172.31.22.129 TCP 74 [TCP Retransmission] [TCP Port numbers reused] 5002 → 5002 [SYN] Seq=0 Win=62727 Len=0 MSS=8961 SACK_PERM=1 TSval=382782031 TSecr=0 WS=128

**Comment by marten-seemann** [comment]
1. No idea what this trace is supposed to tell us. 
2. You don't broadcast on a connection.
3. There's no error anywhere.

**Comment by wade-liwei** [comment]
how to enable the log ?
what can I provide for you ?
